{"_mock":false,"generated_at":"2026-09-28T17:34:04+09:00","source":[{"name":"이동통신 기반 시군구 일별 방문자(월 합계)","provider":"한국관광공사(공공데이터포털 15101972)","retrieved_at":"2026-09-28","url":"https://www.data.go.kr/data/15101972/openapi.do","note":"외지인 방문자수 월 합계. 팀 DB vw_daily_core_signal"},{"name":"특일 정보(공휴일)","provider":"한국천문연구원","retrieved_at":"2026-09-28","note":"2026-07 이후 공휴일은 월력요항으로 보충"}],"period":{"start":"2026-08-01","end":"2027-01-01","granularity":"월"},"caveat":["방법 7가지를 2025년(검증)·2026년(시험) 두 구간에서 시간 순으로 재고, 두 구간 평균 오차가 가장 낮은 '작년 같은 달 + 휴일·명절 보정'을 골랐다. 2026년 시험만 보면 1위는 '작년 같은 달 그대로'(5.52%)였지만 2025년에는 8.67%로 흔들렸다. 최근 증감 추세를 반영한 방법은 모두 2025년에 좋고 2026년에 나빠 쓰지 않았다(한 해의 흐름이 다음 해로 이어지지 않음).","2026년 1~7월 시험 sMAPE: 이 방법 6.29% (1달 앞 6.75%, 6달 앞 6.17%), 작년 같은 달 그대로 5.52%. 문경시만 보면 6.1%.","80% 구간은 2025·2026 두 구간 실제/예측 비율의 몇 달 앞별 10·90분위다(2026년 시험 적중률 76%).","월 합계 전망이다. 날짜별 혼잡이나 지점 쏠림은 보이지 않는다 — 시군구 총량은 지점 급증을 원리적으로 담지 못한다(확정수치: 지점 급증 98% 미탐지).","축제·행사 신설, 콘텐츠 유행 같은 새 사건은 예측에 들어가지 않는다. 검색 신호로 급증을 미리 아는 것은 검증에서 실패했다(AUC 0.217).","데이터 기준일 2026-08-14. 2026-07까지 다 채워진 달을 기준으로 전망했다 (방문자 자료는 공개까지 시차가 있어 매달 갱신한다)."],"data":{"region":{"code":"47280","name":"문경시"},"method":{"key":"SN_CAL","label":"작년 같은 달 + 휴일·명절 보정"},"as_of":"2026-07","history":[{"month":"2024-08","visitors":1107015,"days":31,"full":true,"ly":1074510},{"month":"2024-09","visitors":1202127,"days":30,"full":true,"ly":1240512},{"month":"2024-10","visitors":1150457,"days":31,"full":true,"ly":1141031},{"month":"2024-11","visitors":1009011,"days":30,"full":true,"ly":834564},{"month":"2024-12","visitors":750477,"days":31,"full":true,"ly":676739},{"month":"2025-01","visitors":905415,"days":31,"full":true,"ly":616353},{"month":"2025-02","visitors":648438,"days":28,"full":true,"ly":865049},{"month":"2025-03","visitors":859218,"days":31,"full":true,"ly":794710},{"month":"2025-04","visitors":862067,"days":30,"full":true,"ly":844256},{"month":"2025-05","visitors":1232749,"days":31,"full":true,"ly":947544},{"month":"2025-06","visitors":1002718,"days":30,"full":true,"ly":900193},{"month":"2025-07","visitors":1026721,"days":31,"full":true,"ly":923996},{"month":"2025-08","visitors":1189107,"days":31,"full":true,"ly":1107015},{"month":"2025-09","visitors":994833,"days":30,"full":true,"ly":1202127},{"month":"2025-10","visitors":1600007,"days":31,"full":true,"ly":1150457},{"month":"2025-11","visitors":1109755,"days":30,"full":true,"ly":1009011},{"month":"2025-12","visitors":817911,"days":31,"full":true,"ly":750477},{"month":"2026-01","visitors":792848,"days":31,"full":true,"ly":905415},{"month":"2026-02","visitors":1041502,"days":28,"full":true,"ly":648438},{"month":"2026-03","visitors":899549,"days":31,"full":true,"ly":859218},{"month":"2026-04","visitors":955174,"days":30,"full":true,"ly":862067},{"month":"2026-05","visitors":1267833,"days":31,"full":true,"ly":1232749},{"month":"2026-06","visitors":965716,"days":30,"full":true,"ly":1002718},{"month":"2026-07","visitors":1078374,"days":31,"full":true,"ly":1026721},{"month":"2026-08","visitors":572285,"days":14,"full":false,"ly":1189107}],"outlook":[{"month":"2026-08","h":1,"predicted":1227648,"lower":1119246,"upper":1366004,"last_year":1189108,"yoy":1.032,"trend_factor":1.0,"adjust_factor":1.032,"major_holiday_days":0,"major_holiday_days_ly":0,"rest_days_diff":0,"weekday_holiday_diff":0},{"month":"2026-09","h":2,"predicted":1145239,"lower":1054879,"upper":1262740,"last_year":994833,"yoy":1.151,"trend_factor":1.0,"adjust_factor":1.151,"major_holiday_days":3,"major_holiday_days_ly":0,"rest_days_diff":2,"weekday_holiday_diff":2},{"month":"2026-10","h":3,"predicted":1433105,"lower":1317883,"upper":1604934,"last_year":1600008,"yoy":0.896,"trend_factor":1.0,"adjust_factor":0.896,"major_holiday_days":0,"major_holiday_days_ly":4,"rest_days_diff":-2,"weekday_holiday_diff":-3},{"month":"2026-11","h":4,"predicted":1128486,"lower":1037079,"upper":1288506,"last_year":1109756,"yoy":1.017,"trend_factor":1.0,"adjust_factor":1.017,"major_holiday_days":0,"major_holiday_days_ly":0,"rest_days_diff":-1,"weekday_holiday_diff":0},{"month":"2026-12","h":5,"predicted":844421,"lower":773067,"upper":957911,"last_year":817912,"yoy":1.032,"trend_factor":1.0,"adjust_factor":1.032,"major_holiday_days":0,"major_holiday_days_ly":0,"rest_days_diff":0,"weekday_holiday_diff":0},{"month":"2027-01","h":6,"predicted":831048,"lower":767473,"upper":949639,"last_year":792848,"yoy":1.048,"trend_factor":1.0,"adjust_factor":1.048,"major_holiday_days":0,"major_holiday_days_ly":0,"rest_days_diff":1,"weekday_holiday_diff":0}],"methods":[{"key":"SN","label":"작년 같은 달 그대로","valid_smape":8.67,"test_smape":5.52,"mean_smape":7.09,"chosen":false},{"key":"SN_TREND","label":"작년 같은 달 × 최근 추세","valid_smape":8.65,"test_smape":8.33,"mean_smape":8.49,"chosen":false},{"key":"SN_CAL","label":"작년 같은 달 + 휴일·명절 보정","valid_smape":6.92,"test_smape":6.29,"mean_smape":6.61,"chosen":true},{"key":"CAL","label":"추세 + 휴일·명절 보정","valid_smape":7.78,"test_smape":8.79,"mean_smape":8.29,"chosen":false},{"key":"CAL_ROBUST","label":"명절 달 뺀 추세 + 휴일·명절 보정","valid_smape":6.51,"test_smape":8.84,"mean_smape":7.67,"chosen":false},{"key":"RIDGE","label":"선형 회귀(Ridge)","valid_smape":8.14,"test_smape":8.6,"mean_smape":8.37,"chosen":false},{"key":"GBM","label":"부스팅(HistGradientBoosting)","valid_smape":7.42,"test_smape":7.87,"mean_smape":7.64,"chosen":false}],"rule":"검증(2025)·시험(2026) 두 구간 sMAPE 평균이 가장 낮은 방법","split":{"validation_origins":["2025-01","2025-06"],"test_targets":["2026-01","2026-07"]},"accuracy":{"region_smape":6.07,"national_smape":6.29,"by_horizon":{"1":6.75,"2":6.48,"3":5.64,"4":5.85,"5":6.61,"6":6.17},"baseline_smape":5.52}}}
