{"_mock":false,"generated_at":"2026-09-28T17:36:51+09:00","source":[{"name":"한국관광 데이터랩 월별 패널 (SNS 언급량, 내비게이션 검색건수)","provider":"한국관광공사 — 팀 DB datalab_monthly_panel","retrieved_at":"2026-09-28","url":"https://datalab.visitkorea.or.kr/","note":"적재 2026-09-15. 전월 대비 증가율 − 같은 달 전국(canonical 지역) 중앙값"},{"name":"지역별 방문자수 일별 (외지인)","provider":"한국관광공사 data.go.kr 15101972 — 팀 DB fact_signal","retrieved_at":"2026-09-28","note":"전년 동요일(364일 전) 대비 배율의 7일 중앙값, 임계 초과 7일 지속 (agents/signals.py)"}],"period":{"start":"2024-09-01","end":"2026-08-31","granularity":"월"},"caveat":["관심·의도는 전년 동월 대비 증가율에서 같은 달 전국 중앙값을 뺀 값이다. 전년 대비가 계절성을, 전국 중앙값을 빼는 것이 명절 이동·전국 공통 변동을 지운다 (09.20 패널이 2020-01까지 확장돼 전월 대비에서 전년 대비로 바꿨다).","관심·의도 임계는 패널 전 기간 전국 90백분위다. 지난 달 판정(history)에도 그 뒤 데이터가 반영된 임계를 썼다(표본 내 판정) — 백테스트 성과로 쓰려면 역할2가 시점별 임계로 다시 계산해야 한다.","실현 신호는 데이터랩 패널의 전년 대비 방문자 증감률 대신 일별 외지인 방문자수를 썼다. 패널의 해당 열은 3,108행 중 539행에만 값이 있다. 일별 판정 규칙은 D-12와 같다(7일 지속).","혼잡도 단계는 실측이 없어 비워 두었다. 에이전트③은 현장 조치를 모두 '대기'로 둔다(D-07).","시군구 단위 신호라 해수욕장·점포 같은 지점 쏠림은 보이지 않는다(에이전트① 거제·영월 사례 참조).","데이터랩 패널의 최신 월이 2026-08이라 판정 기준일이 조회일(2026-09-28)보다 늦다. 실시간 경보가 아니라 월 단위 사후 판정이다.","경보 이력은 최근 24개월만 싣는다. 경보 단계 자체는 패널 첫 달부터 D-05 규칙을 이어서 적용한 결과다."],"data":{"region":{"code":"27110","name":"중구"},"as_of":"2026-08-31","alert_level":"주의","previous_alert_level":"주의","cross_validation":[{"stage":"관심","signal":"SNS 언급량 전년 동월 대비 증가율(전국 중앙값 대비 초과분)","provider":"한국관광공사(데이터랩 소셜미디어)","value":-2.4,"threshold":29.8,"unit":"%p","exceeded":false,"trend":"하락"},{"stage":"의도","signal":"내비게이션 검색건수 전년 동월 대비 증가율(전국 중앙값 대비 초과분)","provider":"한국관광공사(데이터랩 내비게이션)","value":-6.0,"threshold":21.3,"unit":"%p","exceeded":false,"trend":"유지"},{"stage":"실현","signal":"외지인 방문자수 전년 동요일 대비 배율(7일 중앙값이 7일간 유지된 수준)","provider":"한국관광공사 지역별 방문자수(data.go.kr 15101972)","value":1.03,"threshold":1.51,"unit":"배","exceeded":false,"trend":"하락"}],"agreement":{"exceeded_count":0,"total":3},"escalation":{"next_level":"경계","required_exceeded":2,"current_exceeded":0,"met":false,"note":"상향은 한 달에 한 단계, 하향은 현 단계 요건 미달이 2개월 연속일 때만 한다 (D-05)."},"history":[{"as_of":"2024-09-30","alert_level":"관심","exceeded_count":0,"exceeded_stages":[],"change":"유지"},{"as_of":"2024-10-31","alert_level":"관심","exceeded_count":0,"exceeded_stages":[],"change":"유지"},{"as_of":"2024-11-30","alert_level":"관심","exceeded_count":0,"exceeded_stages":[],"change":"유지"},{"as_of":"2024-12-31","alert_level":"관심","exceeded_count":0,"exceeded_stages":[],"change":"유지"},{"as_of":"2025-01-31","alert_level":"관심","exceeded_count":0,"exceeded_stages":[],"change":"유지"},{"as_of":"2025-02-28","alert_level":"관심","exceeded_count":0,"exceeded_stages":[],"change":"유지"},{"as_of":"2025-03-31","alert_level":"관심","exceeded_count":0,"exceeded_stages":[],"change":"유지"},{"as_of":"2025-04-30","alert_level":"관심","exceeded_count":0,"exceeded_stages":[],"change":"유지"},{"as_of":"2025-05-31","alert_level":"관심","exceeded_count":0,"exceeded_stages":[],"change":"유지"},{"as_of":"2025-06-30","alert_level":"관심","exceeded_count":0,"exceeded_stages":[],"change":"유지"},{"as_of":"2025-07-31","alert_level":"관심","exceeded_count":0,"exceeded_stages":[],"change":"유지"},{"as_of":"2025-08-31","alert_level":"관심","exceeded_count":0,"exceeded_stages":[],"change":"유지"},{"as_of":"2025-09-30","alert_level":"관심","exceeded_count":0,"exceeded_stages":[],"change":"유지"},{"as_of":"2025-10-31","alert_level":"관심","exceeded_count":0,"exceeded_stages":[],"change":"유지"},{"as_of":"2025-11-30","alert_level":"관심","exceeded_count":0,"exceeded_stages":[],"change":"유지"},{"as_of":"2025-12-31","alert_level":"관심","exceeded_count":0,"exceeded_stages":[],"change":"유지"},{"as_of":"2026-01-31","alert_level":"관심","exceeded_count":0,"exceeded_stages":[],"change":"유지"},{"as_of":"2026-02-28","alert_level":"관심","exceeded_count":0,"exceeded_stages":[],"change":"유지"},{"as_of":"2026-03-31","alert_level":"관심","exceeded_count":0,"exceeded_stages":[],"change":"유지"},{"as_of":"2026-04-30","alert_level":"관심","exceeded_count":0,"exceeded_stages":[],"change":"유지"},{"as_of":"2026-05-31","alert_level":"관심","exceeded_count":0,"exceeded_stages":[],"change":"유지"},{"as_of":"2026-06-30","alert_level":"관심","exceeded_count":0,"exceeded_stages":[],"change":"유지"},{"as_of":"2026-07-31","alert_level":"주의","exceeded_count":1,"exceeded_stages":["관심"],"change":"상향"},{"as_of":"2026-08-31","alert_level":"주의","exceeded_count":0,"exceeded_stages":[],"change":"유지"}],"basis":"8월 판정: 세 신호 모두 임계 미달이다. 주의 요건에 못 미쳤지만 하향은 2개월 연속 미달일 때만 하므로 주의를 유지한다.","manual_ref":{"document":"지속가능한 관광지 혼잡도 운영 관리 매뉴얼(한국관광공사, 2026.03)","page":20,"section":"II. 기획·설계 및 준비 > 관광지 혼잡도 운영관리 시나리오 > 임계치 기반 경보·알림 운용","quote":"경보 기준 설정: 혼잡 단계(4~5), 지속시간, 유입증가율, 정체 고착시간 기준값 정의"}}}
